id,name,ability,firstNightReminder,otherNightReminder,remindersGlobal,reminders
acrobat,Acróbata,"Cada noche*, si uno de tus vecinos honrados está borracho o intoxicado, mueres.",,"Si un vecino honrado está borracho o intoxicado, el jugador Acróbata muere.",,Muerto
alchemist,Alquimista,Posees la habilidad de un Secuaz no presente en la partida.,Muestra al Alquimista la ficha de un Secuaz no presente en la partida.,,Es el Alquimista,
alhadikhia,al-Hadikhia,"Cada noche*, elige a 3 jugadores (todos los jugadores sabrán quiénes): cada uno decide en privado si vive o muere, pero si todos deciden vivir, todos morirán.",,"El al-Hadikhia elige a 3 jugadores. Anuncia al primer jugador, despiértalo para que asienta si quiere vivir o niegue si quiere morir. Mata o resucita según lo elegido y vuelve a hacerlo dormir. Anuncia al siguiente jugador. Si al acabar los 3 jugadores están vivos, los 3 mueren.",,"1,2,3,Elige muerte,Elige vida"
amnesiac,Amnésico,"No sabes cuál es tu habilidad. Cada día, en privado, intenta adivinarla: sabrás si te acercas a adivinarlo (frío/templado/caliente/bingo).",Decide la habilidad del Amnésico. Si la habilidad requiere que se despierte esta noche: despiértalo para usarla.,Si la habilidad del Amnésico requiere que se despierte esta noche: despiértalo para usarla.,,?
angel,Ángel,Algo malo puede pasarle a aquel que tenga mayor responsabilidad en la muerte de un nuevo jugador.,,,,"Protect,Something Bad"
apprentice,Aprendiz,"Tu 1ª noche, obtienes una habilidad de Aldeano (si eres honrado) o una habilidad de Secuaz (si eres maligno).","Muestra al Aprendiz la tarjeta ""Eres"" y una ficha de Aldeano o de Secuaz. En el Grimorio, sustituye la ficha de Aprendiz por la de ese personaje y pon el recordatorio ""Es el Aprendiz"" al lado de la ficha de ese personaje.",,,Es el aprendiz
artist,Artista,"Una vez por partida, durante el día, pregunta al Narrador en privado una pregunta de sí o no.",,,,Sin habilidad
assassin,Asesina,"Una vez por partida, durante la noche*, elige a un jugador: morirá, incluso si por cualquier razón no puede morir.",,Si la Asesina no ha utilizado su habilidad aún: la Asesina niega con la cabeza o señala a un jugador. Ese jugador muere.,,"Muerto,Sin habilidad"
atheist,Ateo,"El Narrador puede romper las reglas del juego y, si es ejecutado, el Bien gana, incluso aunque estés muerto. [No hay jugadores malignos]",,,,
balloonist,Aeronauta,"Cada noche, conocerás a 1 jugador de cada tipo de personaje hasta que no haya más tipos. [+1 Forastero]",Elige un tipo de personaje. Señala a un jugador que tenga un personaje de ese tipo. Pon el recordatorio ""Divisado"" del Aeronauta junto a ese personaje.,"Elige un tipo de personaje que aún no tenga el recordatorio ""Divisado"" junto a un personaje de ese tipo. Señala a un jugador cuyo personaje sea de ese tipo, si los hay. Pon el recordatorio ""Divisado"" del Aeronauta junto a ese personaje.",,"Aldeano Divisado,Demonio Divisado,Forastero Divisado,Secuaz Divisado,Viajero Divisado"
barber,Barbero,"Si has muerto hoy o esta noche, el Demonio puede elegir a 2 jugadores (no otro Demonio) que intercambiarán personajes.",,Si el Barbero murió hoy: despierta al Demonio. Muestra la tarjeta ""Este personaje te ha elegido"" y la ficha del Barbero. El Demonio puede negar con la cabeza o señalar a 2 jugadores. Si elige jugadores: intercambia sus fichas de personaje. Despierta a cada jugador. Muéstrale ""Eres"" y su nueva ficha de personaje.,,Cortes de pelo esta noche
barista,Barista,"Cada noche, hasta el ocaso, 1) un jugador está sobrio, sano y obtiene información correcta, o 2) su habilidad funciona dos veces.","Elige a un jugador, despiértalo y dile qué poder del Barista le está afectando. Trátalo según el poder (sobrio/sano/información correcta o activa su habilidad dos veces).","Elige a un jugador, despiértalo y dile qué poder del Barista le está afectando. Trátalo según el poder (sobrio/sano/información correcta o activa su habilidad dos veces).",,"Habilidad doble,Sobrio y Sano"
baron,Barón,Hay Forasteros extra en la partida. [+2 Forasteros],,,,
beggar,Mendigo,"Necesitas utilizar una ficha de voto para votar. Los jugadores muertos pueden darte el suyo. Si lo hacen, sabrás de qué bando son.",,,,
bishop,Obispo,Solo el Narrador puede nominar. Al menos 1 jugador del bando contrario debe ser nominado cada día.,,,,"Nominar honrado,Nominar maligno"
bonecollector,Profanador,"Una vez por partida, durante la noche, elige a un jugador muerto: recobrará su habilidad hasta el ocaso.",,"El Profanador puede negar con la cabeza o señalar a cualquier jugador muerto. Si señalan a un jugador muerto, pon el recordatorio ""Con Habilidad"" del Profanador junto a la ficha de personaje del jugador elegido. (Pueden despertarse esta noche para usarla si es necesario.)",,"Con habilidad,Sin habilidad"
boomdandy,Explotador,"Si te ejecutan, mueren todos los jugadores excepto 3. Después de 1 minuto, quien tenga a más jugadores señalándole muere.",,,,
bountyhunter,Cazarrecompensas,"Comienzas conociendo a 1 jugador maligno. Si ese jugador muere, conocerás a otro jugador maligno esta noche. [1 Aldeano es maligno]",Despierta al Aldeano maligno y muéstrale la tarjeta ""Eres"" y el signo de maligno con el pulgar hacia abajo.,"Si el jugador maligno conocido está muerto, señala a otro jugador maligno.",,Conocido
buddhist,Budista,"Los primeros 2 minutos de cada día, los jugadores veteranos no pueden hablar.",,,,
bureaucrat,Burócrata,"Cada noche, elige a un jugador (no a ti mismo): su voto cuenta como 3 votos mañana.",El Burócrata señala a un jugador. Pon el recordatorio ""3 votos"" junto a la ficha de personaje del jugador.,El Burócrata señala a un jugador. Pon el recordatorio ""3 votos"" del Burócrata junto a la ficha de personaje del jugador.,,3 votos
butcher,Carnicero,"Cada día, después de la 1ª ejecución, puedes volver a nominar.",,,,
butler,Mayordomo,"Cada noche, elige a un jugador (no a ti mismo): mañana, solo puedes votar si dicho jugador vota también.",El Mayordomo señala a un jugador. Marca a dicho jugador como ""Señor"".,El Mayordomo señala a un jugador. Marca a dicho jugador como ""Señor"".,,Señor
cannibal,Caníbal,"Obtienes la habilidad del ejecutado más reciente. Si es maligno, estarás intoxicado hasta que un jugador honrado muera ejecutado.",,,,"Intoxicado,Muerto hoy"
cerenovus,Cerenovus,"Cada noche, elige a un jugador y un personaje honrado: el jugador está ""loco"" y debe hacer creer que es este personaje mañana o podría ser ejecutado.","El Cerenovus señala a un jugador, y elige un personaje de su hoja. Despierta a ese jugador. Muéstrale la tarjeta ""Este personaje te ha elegido"" y la ficha del Cerenovus. Muéstrale la ficha del personaje elegido. Si el jugador no intenta hacer creer que este personaje mañana, puede ser ejecutado.","El Cerenovus señala a un jugador, y elige un personaje de su hoja. Despierta a ese jugador. Muéstrale la tarjeta ""Este personaje te ha elegido"" y la ficha del Cerenovus. Muéstrale la ficha del personaje elegido. Si el jugador no intenta hacer creer que este personaje mañana, puede ser ejecutado.",,Loco
chambermaid,Criada,"Cada noche, elige a 2 jugadores vivos (no a ti mismo): sabrás cuántos se han despertado durante la noche para usar su habilidad.","La Criada señala a dos jugadores. Muéstrale la señal numérica (0, 1, 2, ...) indicando cuántos de esos jugadores se han despertado esta noche por su habilidad.","La Criada señala a dos jugadores. Muéstrale la señal numérica (0, 1, 2, ...) indicando cuántos de esos jugadores se han despertado esta noche por su habilidad.",,
chef,Cocinero,Comienzas sabiendo cuántas parejas de jugadores malignos hay.,"Muestra con los dedos (0, 1, 2, ...) cuántos pares de jugadores malignos hay sentados juntos.",,,
choirboy,Corista,"Si el Demonio mata al Rey, sabrás qué jugador es el Demonio. [+ el Rey]",,"Si el Demonio mata al Rey, despierta al Corista y señálale al Demonio.",,
clockmaker,Relojero,Comienzas sabiendo cuántos pasos hay desde el Demonio hasta su Secuaz más cercano.,"Muestra la señal numérica (1, 2, 3, etc.) de los pasos entre el Demonio y su Secuaz más cercano.",,,
courtier,Cortesana,"Una vez por partida, durante la noche, elige a un personaje: estará borracho 3 noches y 3 días.","La Cortesana puede negar con la cabeza o señalar a un personaje de la hoja. Si la Cortesana utiliza su habilidad: si ese personaje está presente en la partida, ese jugador estará borracho.","Reduce el número de días restantes que el jugador estará borracho. Si la Cortesana no ha usado aún su habilidad: la Cortesana puede negar con la cabeza o señalar un personaje de la hoja. Si la Cortesana ha usado su habilidad: si ese personaje está presente en la partida, ese jugador estará borracho.",,"Borracho 1,Borracho 2,Borracho 3,Sin habilidad"
cultleader,Sectario,"Cada noche, pasas al bando de un vecino vivo. Si todos los personajes honrados deciden unirse a tu secta, tu equipo gana.","Si el Sectario cambia de bando, muéstrale la señal de honrado con el pulgar hacia arriba o de maligno con el pulgar hacia abajo según corresponda.","Si el Sectario cambia de bando, muéstrale la señal de honrado con el pulgar hacia arriba o de maligno con el pulgar hacia abajo según corresponda.",,
damsel,Doncella,"Todos los Secuaces saben que estás en la partida. Si un Secuaz adivina (un solo intento) quién eres en público, tu equipo pierde.","Despierta a todos los Secuaces, muéstrales la tarjeta ""Este personaje te ha elegido"" y la ficha de la Doncella.","Si el Cazador la selecciona, despierta a la Doncella, muéstrale la tarjeta ""Eres"" y la ficha de un Aldeano que no esté presente en la partida.",,Intento agotado
deusexfiasco,Deus ex Fiasco,"Once per game, the Storyteller will make a ""mistake"", correct it and publicly admit to it.",,,,Whoops
deviant,Descarriado,"Si has sido gracioso hoy, no puedes morir exiliado.",,,,
devilsadvocate,Abogado del diablo,"Cada noche, elige a un jugador vivo (diferente al anterior): si es ejecutado mañana, no muere.",El Abogado del diablo señala a un jugador vivo. Este jugador sobrevive a la ejecución mañana.,"El Abogado del diablo señala a un jugador vivo, diferente al de la noche anterior. Este jugador sobrevive a la ejecución mañana.",,Sobrevive a la ejecución
djinn,Genio,Usa la regla especial del Genio. Todos los jugadores la conocen.,,,,
doomsayer,Agorero,"Si 4 o más jugadores viven, cada jugador vivo puede decidir públicamente (una vez por partida) que un jugador de su propio bando muere.",,,,
dreamer,Soñador,"Cada noche, elige a un jugador (no a ti mismo ni a Viajeros): sabrás 1 personaje honrado y 1 personaje maligno, 1 de ellos es correcto.","El Soñador señala a un jugador. Muestra 1 ficha de personaje honrado y 1 de personaje maligno, una de ella es correcta.","El Soñador señala a un jugador. Muestra 1 ficha de personaje honrado y 1 de personaje maligno, una de ella es correcta.",,
drunk,Borracho,"No sabes que eres el Borracho. Crees que eres un Aldeano, pero no lo eres.",,,Borracho,
duchess,Duquesa,"Cada día, 3 jugadores pueden decidir visitarte. Durante la noche*, cada visitante sabrá cuántos visitantes son malignos, pero 1 recibe información falsa.",,,,"False Info,Visitor"
empath,Émpata,"Cada noche, sabrás cuántos de tus dos vecinos vivos son malignos.","Muestra la seña numérica con los dedos (0, 1, 2) indicando el número de vecinos malignos vivos del Émpata.","Muestra la seña numérica con los dedos (0, 1, 2) indicando el número de vecinos malignos vivos del Émpata.",,
engineer,Ingeniero,"Una vez por partida, durante la noche, elige qué Secuaces o qué Demonio está presente en la partida.","El Ingeniero niega con la cabeza o señala un Demonio o a los Secuaces necesarios. Si el ingeniero decide elegir personajes, sustituye al Demonio o a los Secuaces por sus elecciones, después despierta a los jugadores implicados y muéstrales la tarjeta ""Eres"" y la ficha de personaje pertinente.","El Ingeniero niega con la cabeza o señala un Demonio o a los Secuaces necesarios. Si el ingeniero decide elegir personajes, sustituye al Demonio o a los Secuaces por sus elecciones, después despierta a los jugadores implicados y muéstrales la tarjeta ""Eres"" y la ficha de personaje pertinente.",,Sin habilidad
eviltwin,Gemelo corrupto,"Tú y un jugador del bando opuesto sabéis quiénes sois. Si el jugador honrado es ejecutado, el Mal triunfa. El Bien no puede triunfar si los dos gemelos viven.",Despierta al Gemelo corrupto y a su gemelo. Confirma que ambos se reconocen. Señala al Gemelo corrupto. Muéstrale la ficha de Gemelo corrupto al gemelo honrado. Señala al gemelo honrado. Muéstrale la ficha de su personaje al Gemelo corrupto.,,,Gemelo
exorcist,Exorcista,"Cada noche*, elige a un jugador (diferente al de la noche anterior): el Demonio, si es elegido, sabrá quién eres y no despertará esta noche.",,"El Exorcista señala a un jugador, diferente del de la noche anterior. Si ese jugador es el Demonio: despierta al demonio. Muéstrale la ficha del Exorcista. Señala al Exorcista. El Demonio no actúa esta noche.",,Elegido
fanggu,Fang Gu,"Cada noche*, elige a un jugador: morirá. El 1º Forastero que mates se convertirá en un Fang Gu maligno y tú morirás en su lugar. [+1 Forastero]",,"El Fang Gu señala a un jugador. Ese jugador muere. O, si ese jugador era un Forastero y no hay otros Fang Gu presentes en la partida: el Fang Gu muere en lugar del jugador elegido. El jugador elegido es ahora un Fang Gu maligno. Despierta al nuevo Fang Gu. Muéstrale la tarjeta ""Eres"" y la ficha de Fang Gu. Muéstrale la tarjeta ""Eres"" y el signo de maligno con el pulgar hacia abajo.",,"Muerto,Una vez"
farmer,Granjero,"Si mueres durante la noche, un jugador honrado vivo se convierte en el Granjero.",,"Si un Granjero muere esta noche, elige a otro jugador honrado y conviértelo en el Granjero. Despiértalo y muéstrale la tarjeta ""Eres"" y la ficha de personaje del Granjero.",,
fearmonger,Agitador,"Cada noche, elige a un jugador. Si lo nominas y es ejecutado, su equipo pierde. Todos los jugadores saben si has elegido a un nuevo jugador.",El Agitador señala a un jugador. Pon el recordatorio de ""Agitado"" junto a ese jugador y anuncia que un nuevo jugador ha sido seleccionado con la habilidad del Agitador.,"El Agitador señala a un jugador. Si es diferente al de la noche anterior, por el recordatorio de ""Agitado"" junto a ese jugador y anuncia que un nuevo jugador ha sido elegido con la habilidad del Agitador.",,Agitado
fibbin,Embustero,"Una vez por partida, 1 jugador honrado podría recibir información falsa.",,,,Used
fiddler,Violinista,"Una vez por partida, el Demonio elige en secreto a un jugador del bando opuesto: todos los jugadores deciden cuál de estos dos jugadores gana.",,,,
fisherman,Pescador,"Una vez por partida, durante el día, visita al Narrador para obtener alguna pista que te ayude a ganar.",,,,Sin habilidad
flowergirl,Florista,"Cada noche*, sabrás si un Demonio votó hoy.",,"Indica que sí o que no con la cabeza para confirmar si el Demonio votó hoy. Pon el recordatorio ""El Demonio no votó (o quita el recordatorio ""El Demonio votó"", si lo hay).",,"El Demonio no votó,El Demonio votó"
fool,Bufón,"La primera vez que mueres, no mueres.",,,,Sin habilidad
fortuneteller,Vidente,"Cada noche, elige a 2 jugadores: sabrás si alguno de ellos es un Demonio. Un jugador honrado te aparecerá como Demonio.",La Vidente señala a dos jugadores. Afirma o niega con la cabeza para decirle si uno de ellos es el Demonio.,La Vidente señala a dos jugadores. Afirma o niega con la cabeza para decirle si uno de ellos es el Demonio.,,Señuelo
gambler,Tahúr,"Cada noche*, elige a un jugador e intenta adivinar su personaje: si no aciertas, mueres.",,"El Tahúr señala a un jugador y un personaje de la hoja. Si no es correcto, el Tahúr muere.",,Muerto
gangster,Mafioso,"Una vez al día, puedes decidir matar a un vecino vivo, si yo otro vecino vivo está de acuerdo.",,,,
general,General,"Cada noche, sabrás qué bando va ganando según el Narrador: el Bien, el Mal o ninguno.","Muestra al General el pulgar hacia arriba para señalar que el Bien está ganando, el pulgar hacia abajo para el Mal ganando o el pulgar hacia un lado para ninguno.","Muestra al General el pulgar hacia arriba para señalar que el Bien está ganando, el pulgar hacia abajo para el Mal ganando o el pulgar hacia un lado para ninguno.",,
goblin,Goblin,"Si declaras públicamente ser el Goblin cuando te nominan y te ejecutan ese día, tu equipo gana.",,,,Declarado
godfather,Padrino,"Comienzas sabiendo qué Forasteros están presentes en la partida. Si 1 muere hoy, elige a un jugador esta noche: morirá. [-1 o +1 Forastero]",Muestra todas las fichas de Forasteros presentes en la partida.,Si un Forastero muere hoy: el Padrino señala a un jugador. Ese jugador muere.,,"Muerto,Muerto hoy"
golem,Gólem,"Cuando lo hagas, si el nominado no es el Demonio, morirá.",,,,No puede nominar
goon,Matón,"Cada noche, el 1º jugador que te elija con su habilidad estará borracho hasta el ocaso. Pasas a su bando,",,,,Borracho
gossip,Chismoso,"Cada día puedes hacer una declaración pública. Si lo que dijiste es cierto, esta noche morirá un jugador.",,Si la declaración pública del Chismoso era cierta: elige a un jugador que no esté protegido de morir esta noche. Ese jugador muere.,,Muerto
grandmother,Abuelita,"Comienzas sabiendo quién es uno de los jugadores honrados y su personaje. Si el Demonio lo mata, tú también mueres.",Muestra la ficha del personaje marcado. Señala al jugador marcado.,Si el Demonio mata al nieto de la Abuela: la Abuela muere.,,Nieto
gunslinger,Pistolero,"Cada día, después de que la primera votación fracase, puedes elegir uno de los personajes que votó en ella: morirá.",,,,
harlot,Meretriz,"Cada noche*, elige a un jugador con vida: si lo consiente, sabrás cuál es su personaje, pero ambos jugadores podrían morir.",,"La Meretriz señala a un jugador. La Meretriz vuelve a dormir. Despierta al jugador elegido, muéstrale la tarjeta ""Este personaje te ha seleccionado"" y la ficha de la Meretriz. Ese jugador puede afirmar o negar con la cabeza. Si afirma, despierta a la Meretriz y muéstrale la ficha de personaje del jugador elegido. Después, decide si ambos jugadores mueren.",,Muerto
hellslibrarian,Bibliotecario infernal,Algo malo puede pasar a quien hable cuando el Narrador ha pedido guardar silencio.,,,,Something Bad
heretic,Hereje,"Quien gane, pierde y quien pierda, gana, aunque estés muerto.",,,,
huntsman,Cazador,"Una vez por partida, durante la noche, elige a un jugador con vida: si eliges a la Doncella, esta se convierte en un Aldeano no presente en la partida. [+la Doncella]","El Cazador puede negar con la cabeza o señalar a un jugador. Si señalan a la Doncella, despierta a ese jugador, muéstrale la tarjeta ""Eres"" y la ficha de un personaje Aldeano no presente en la partida.","El Cazador puede negar con la cabeza o señalar a un jugador. Si señalan a la Doncella, despierta a ese jugador, muéstrale la tarjeta ""Eres"" y la ficha de un personaje Aldeano no presente en la partida.",,Sin habilidad
imp,Diablillo,"Cada noche*, elige a un jugador: morirá. Si te matas a ti mismo, un Secuaz se convertirá en el Diablillo.",,El Diablillo señala a un jugador. Ese jugador muere. Si el Diablillo se elige a sí mismo: sustituye el personaje de 1 Secuaz con vida con una ficha extra de Diablillo. Muéstrale la tarjeta ""Eres"" y la ficha del Diablillo.,,Muerto
innkeeper,Posadero,"Cada noche*, elige a 2 jugadores: esta noche no pueden morir, pero 1 estará borracho hasta el ocaso.",,"Los jugadores de la noche anterior pierden sus marcadores (protegido, borracho). El Posadero señala a dos jugadores. Esos jugadores están protegidos. Uno está borracho.",,"Borracho,Protegido"
investigator,Detective,Comienzas sabiendo que 1 de 2 jugadores es un Secuaz específico.,"Muestra la ficha de personaje de un Secuaz presente en la partida. Señala a dos jugadores, uno de los cuales es ese personaje.",,,"Incorrecto,Secuaz"
judge,Juez,"Una vez por partida, si otro jugador nominó, puedes decidir si la ejecución es aprobada o no.",,,,Sin habilidad
juggler,Malabarista,"Tu 1º día, intenta adivinar públicamente los personajes de hasta 5 jugadores. Esa noche, sabrás cuántos has acertado.",,"Si hoy fue el primer día del Malabarista: muéstrale con los dedos el número (0, 1, 2, etc.) de aciertos. Quita los marcadores.",,Correcto
king,Rey,"Cada noche, si hay más jugadores muertos que vivos, sabrás 1 personaje vivo. El Demonio sabe quién eres.","Despierta al Demonio, muéstrale la tarjeta ""Este personaje te ha seleccionado"", muéstrale la ficha del Rey y señala al jugador que es el Rey.","Si hay más jugadores muertos que vivos, muéstra al Rey la ficha de personaje de un jugador vivo.",,
klutz,Cafre,"Al saber que has muerto, elige públicamente a 1 jugador vivo: si es maligno, tu equipo pierde.",,,,
legion,Legión,"Cada noche*, un jugador podría morir. Las ejecuciones no son aprobadas si solo vota el bando maligno. Apareces como un Secuaz también. [La mayoría de los jugadores son Legión.]",,"Elige a un jugador, ese jugador muere.",,"A punto de morir,Muerto"
leviathan,Leviatán,"Si más de 1 jugador honrado es ejecutado, ganas. Todos los jugadores saben que estás en la partida. Tras el 5º día, el Mal triunfa.","Pon el marcador ""Día 1"" del Leviatán. Anuncia 'El Leviatán está entre nosotros, este es el Día 1'.",Cambia el recordatorio de Día del Leviatán para el día siguiente.,,"Día 1,Día 2,Día 3,Día 4,Día 5,Jugador honrado ejecutado"
librarian,Bibliotecario,Comienzas sabiendo que 1 de 2 jugadores es un Forastero específico. (O que no hay ninguno presente en la partida.),"Muestra la ficha de personaje de un Forastero presente en la partida. Señala a dos jugadores, uno de los cuales es ese personaje.",,,"Forastero,Incorrecto"
lilmonsta,Monstruito,"Cada noche, los Secuaces eligen quién cuida de la ficha del Monstruito y ""es el Demonio"". Un jugador muere cada noche*. [+1 Secuaz]","Despierta a todos los Secuaces juntos, permíteles voten señalando a quién quieran que cuide al Monstruito.","Despierta a todos los Secuaces juntos, permíteles voten señalando a quién quieran que cuide al Monstruito. Elige a un jugador, ese jugador muere.","Es el Demonio,Muerto",
lleech,Sanguijuela,"Cada noche*, elige a un jugador: morirá. Comienzas eligiendo a un jugador vivo: será envenenado y tú mueres sola y exclusivamente si él muere.",La Sanguijuela señala a un jugador. Pon el recordatorio de ""Envenenado"".,La Sanguijuela señala a un jugador. Ese jugador muere.,,"Envenenado,Muerto"
lunatic,Lunático,"Crees que eres un Demonio, pero no lo eres. El Demonio sabe quién eres y a quién eliges cada noche.",Si hay 7 o más jugadores: muestra al Lunático un número arbitrario de 'Secuaces' igual al número de Secuaces presentes en la partida. Muéstrale 3 fichas de personajes honrados aleatorias. si la ficha recibida por el Lunático es un Demonio que debe despertarse esta noche: permítele que realice las acciones del Demonio. Pon sus marcadores de 'ataque'. Despierta al Demonio. Muéstrale la ficha de personaje demoníaco real. Muéstrale al jugador Lunático. Si el Lunático ha atacado a jugadores: muéstrale al demonio real los jugadores marcados. Elimina todos los marcadores de 'ataque' del Lunático.,Permite al Lunático que realice las acciones del Demonio. Pon sus marcadores de 'ataque'. Si el Lunático ha atacado a jugadores: despierta al Demonio. Muéstrale el marcador de 'ataque' y señala a cada jugador marcado. Elimina todos los marcadores de 'ataque' del Lunático.,,"Ataque 1,Ataque 2,Ataque 3"
lycanthrope,Licántropo,"Cada noche*, elige a un jugador con vida: si es honrado, muere, pero es el único jugador que puede morir esta noche.",,"El Licántropo señala a un jugador vivo: si es honrado, muere y nadie más puede morir esta noche.",,Muerto
magician,Mago,El Demonio cree que eres un Secuaz. Los Secuaces creen que eres un Demonio.,,,,
marionette,Marioneta,"Crees que eres un personaje honrado, pero no lo eres. El Demonio sabe quién eres. [Estás sentado al lado del Demonio.]",Selecciona a uno de los jugadores honrados sentados junto al Demonio y ponle el recordatorio ""Es la Marioneta"". Despierta al Demonio e indícale quién es la Marioneta.,,Es la Marioneta,
mastermind,Maquiavélico,"Si el Demonio muere ejecutado (terminando así la partida), se juega 1 día más. Si se ejecuta a un jugador, su equipo pierde.",,,,
mathematician,Matemático,"Cada noche, sabrás cuántas habilidades de jugadores han funcionado de forma anormal (desde el alba) por influencia de la habilidad de otro personaje.","Muestra con la mano el número (0, 1, 2, etc.) de jugadores cuya habilidad ha funcionado de forma anormal debido a otras habilidades.","Muestra con la mano el número (0, 1, 2, etc.) de jugadores cuya habilidad ha funcionado de forma anormal debido a otras habilidades.",,Anormal
matron,Matrona,"Cada día, puedes elegir hasta 3 parejas de jugadores para que intercambien sus asientos. Ningún jugador puede abandonar su asiento para hablar en privado.",,,,
mayor,Alcalde,"Si solo quedan 3 jugadores con vida y no hay ejecución, tu equipo gana. Si mueres durante la noche, otro jugador podría morir en tu lugar.",,,,
