id,name,ability,firstNightReminder,otherNightReminder,remindersGlobal,reminders
pithag,Chekwragh,"Pub nos*, choose a player & a character they become (if not-in-play). If a Demon is made, deaths tonight are arbitrary.",,"The Pit-Hag points to a player and a character on the sheet. If this character is not in play, wake that player and show them the 'You are' card and the relevant character token. If the character is in play, nothing happens.",,
pixie,Piski,"You start knowing 1 in-play Townsfolk. If you were mad that you were this character, you gain their ability when they die.",Show the Pixie 1 in-play Townsfolk character token.,,,"Fol,Gans gallos"
po,Po,"Pub nos*, you may choose a player: they die. If your last choice was no-one, choose 3 players tonight.",,"If the Po chose no-one the previous night: The Po points to three players. Otherwise: The Po either shows the 'no' head signal , or points to a player. Chosen players die",,"3 omsettyans,Marow"
poisoner,Posnyer,"Pub nos, choose a player: they are poisoned tonight and tomorrow day.",The Poisoner points to a player. That player is poisoned.,The previously poisoned player is no longer poisoned. The Poisoner points to a player. That player is poisoned.,,Posnys
politician,Gwlaseger,"If you were the player most responsible for your team losing, you change alignment & win, even if dead.",,,,
poppygrower,Tevyer Myll,"Minions & Demons do not know each other. If you die, they learn who each other are that night.",Do not inform the Demon/Minions who each other are,"If the Poppy Grower has died, show the Minions/Demon who each other are.",,Tebel a wra difuna
preacher,Pronter,"Pub nos, choose a player: a Minion, if chosen, learns this. All chosen Minions have no ability.","The Preacher chooses a player. If a Minion is chosen, wake the Minion and show the 'This character selected you' card and then the Preacher token.","The Preacher chooses a player. If a Minion is chosen, wake the Minion and show the 'This character selected you' card and then the Preacher token.",,Orth pregoth
professor,Professor,"Unweyth y'n gwari, at night*, choose a dead player: if they are a Townsfolk, they are resurrected.",,"If the Professor has not used their ability: The Professor either shakes their head no, or points to a player. If that player is a Townsfolk, they are now alive.",,"Bew,Heb gallos"
psychopath,Sykopath,"Pub jydh, before nominations, you may publicly choose a player: they die. If executed, you only die if you lose roshambo.",,,,
pukka,Pukka,"Pub nos, choose a player: they are poisoned. The previously poisoned player dies then becomes healthy.",The Pukka points to a player. That player is poisoned.,The Pukka points to a player. That player is poisoned. The previously poisoned player dies.,,"Marow,Posnys"
puzzlemaster,Dismyger,"1 player is drunk, even if you die. If you guess (once) who it is, learn the Demon player, but guess wrong & get false info.",,,,"Dismyk usys,Medhow"
ravenkeeper,Gwithyas Brini,"If you die at night, you are woken to choose a player: you learn their character.",,If the Ravenkeeper died tonight: The Ravenkeeper points to a player. Show that player’s character token.,,
recluse,Ankar,"You might register as evil & as a Minion or Demon, even if dead.",,,,
revolutionary,Hweldroyas,"2 neighboring players are known to be the same alignment. Unweyth y'n gwari, one of them registers falsely",,,,Register Falsely?
riot,Gostel,"Nominees die, but may nominate again immediately (on day 3, they must). After day 3, evil wins. [All Minions are Riot]",,,,
sage,Doth,"If the Demon kills you, you learn that it is 1 of 2 players.",,"If the Sage was killed by a Demon: Point to two players, one of which is that Demon.",,
sailor,Marner,"Pub nos, choose an alive player: either you or they are drunk until dusk. You can't die.","The Sailor points to a living player. Either the Sailor, or the chosen player, is drunk.","The previously drunk player is no longer drunk. The Sailor points to a living player. Either the Sailor, or the chosen player, is drunk.",,Medhow
saint,Sans,"If you die by execution, your team loses.",,,,
savant,Skolheyk,"Pub jydh, you may visit the Storyteller to learn 2 things in private: 1 is true & 1 is false.",,,,
scapegoat,Bogh Skappys,"If a player of your alignment is executed, you might be executed instead.",,,,
scarletwoman,Benyn Gogh,"If there are 5 or more players alive & the Demon dies, you become the Demon. (Travellers don’t count)",,"If the Scarlet Woman became the Demon today: Show the 'You are' card, then the demon token.",,Jevan
seamstress,Gwriadores,"Unweyth y'n gwari, at night, choose 2 players (not yourself): you learn if they are the same alignment.","The Seamstress either shows a 'no' head signal, or points to two other players. If the Seamstress chose players , nod 'yes' or shake 'no' for whether they are of same alignment.","If the Seamstress has not yet used their ability: the Seamstress either shows a 'no' head signal, or points to two other players. If the Seamstress chose players , nod 'yes' or shake 'no' for whether they are of same alignment.",,Heb gallos
sentinel,Sentinel,There might be 1 extra or 1 fewer Outsider in-play.,,,,
shabaloth,Shabaloth,"Pub nos*, choose 2 players: they die. A dead player you chose last night might be regurgitated.",,One player that the Shabaloth chose the previous night might be resurrected. The Shabaloth points to two players. Those players die.,,"Bew,Marow"
slayer,Ledhyas,"Unweyth y'n gwari, during the day, publicly choose a player: if they are the Demon, they die.",,,,Heb gallos
snakecharmer,Gorhenyas Serf,"Pub nos, choose an alive player: a chosen Demon swaps characters & alignments with you & is then poisoned.",The Snake Charmer points to a player. If that player is the Demon: swap the Demon and Snake Charmer character and alignments. Wake each player to inform them of their new role and alignment. The new Snake Charmer is poisoned.,The Snake Charmer points to a player. If that player is the Demon: swap the Demon and Snake Charmer character and alignments. Wake each player to inform them of their new role and alignment. The new Snake Charmer is poisoned.,,Posnys
snitch,Traytour,Minions start knowing 3 not-in-play characters.,After Minion info wake each Minion and show them three not-in-play character tokens. These may be the same or different to each other and the ones shown to the Demon.,,,
soldier,Souder,You are safe from the Demon.,,,,
spiritofivory,Spyrys Wynn,There can't be more than 1 extra evil player.,,,,No extra evil
spy,Aspier,"Pub nos, you see the Grimoire. You might register as good & as a Townsfolk or Outsider, even if dead.",Show the Grimoire to the Spy for as long as they need.,Show the Grimoire to the Spy for as long as they need.,,
stormcatcher,Kechyer Tewedhow,"Name a good character. If in play, they can only die by execution, but evil players learn which player it is.",,,,Safe
sweetheart,Keryas,"When you die, 1 player is drunk from now on.",,Choose a player that is drunk.,,Medhow
tealady,Benyn De,"If both your alive neighbours are good, they can't die.",,,,Ny yll merwel
thief,Lader,"Pub nos, choose a player (not yourself): their vote counts negatively tomorrow.",The Thief points to a player. Put the Thief's 'Negative vote' reminder by the chosen player's character token.,The Thief points to a player. Put the Thief's 'Negative vote' reminder by the chosen player's character token.,,Raglev negedhek
tinker,Ser Gwynn,You might die at any time.,,The Tinker might die.,,Marow
towncrier,Krier an Dre,"Pub nos*, you learn if a Minion nominated today.",,"Nod 'yes' or shake head 'no' for whether a Minion nominated today. Place the 'Minion not nominated' marker (remove 'Minion nominated', if any).",,"Ny henwis Servont,Servont a henwis"
toymaker,Gwrier Tegennow,The Demon may choose not to attack & must do this at least Unweyth y'n gwari. Evil players get normal starting info.,,,,No Attack
undertaker,Ynkleudhyer,"Pub nos*, you learn which character died by execution today.",,If a player was executed today: Show that player’s character token.,,Eksekutys
vigormortis,Vigormortis,"Pub nos*, choose a player: they die. Minions you kill keep their ability & poison 1 Townsfolk neighbour. [−1 Outsider]",,"The Vigormortis points to a player. That player dies. If a Minion, they keep their ability and one of their Townsfolk neighbours is poisoned.",,"Gans gallos,Marow,Posnys"
virgin,Gwerghes,"The 1st time you are nominated, if the nominator is a Townsfolk, they are executed immediately.",,,,Heb gallos
vortox,Vortoks,"Pub nos*, choose a player: they die. Townsfolk abilities yield false info. Pub jydh, if no-one is executed, evil wins.",,The Vortox points to a player. That player dies.,,Marow
voudon,Voudon,Only you and the dead can vote. They don't need a vote token to do so. A 50% majority is not required.,,,,
washerwoman,Golgheres,You start knowing that 1 of 2 players is a particular Townsfolk.,"Show the character token of a Townsfolk in play. Point to two players, one of which is that character.",,,"Burjes,Kamm"
widow,Gwedhwes,"On your 1st night, look at the Grimoire and choose a player: they are poisoned. 1 good player knows a Widow is in play.","Show the Grimoire to the Widow for as long as they need. The Widow points to a player. That player is poisoned. Wake a good player. Show the 'These characters are in play' card, then the Widow character token.",,a Wor,Posnys
witch,Gwragh,"Pub nos, choose a player: if they nominate tomorrow, they die. If just 3 players live, you lose this ability.",The Witch points to a player. If that player nominates tomorrow they die immediately.,If there are 4 or more players alive: The Witch points to a player. If that player nominates tomorrow they die immediately.,,Miligys
zombuul,Zomboul,"Pub nos*, if no-one died today, choose a player: they die. The 1st time you die, you live but register as dead.",,If no-one died during the day: The Zombuul points to a player. That player dies.,,"Marow,Marow hedhyw"