id,name,ability,firstNightReminder,otherNightReminder,remindersGlobal,reminders
acrobat,Lappyer,"Pub nos*, mars yw kentrevek bew mas po medhow po posnys, ty a verow.",,"If a good living neighbour is drunk or poisoned, the Acrobat player dies.",,Marow
alchemist,Alkemydh,Yma dhis gallos Servont heb-bos-y'n-gwari.,Show the Alchemist a not-in-play Minion token,,An Alkemydh yw,
alhadikhia,Al-Hadikia,"Pub nos*, choose 3 players (all players learn who): each silently chooses to live or die, but if all live, all die.",,"The Al-Hadikhia chooses 3 players. Announce the first player, wake them to nod yes to live or shake head no to die, kill or resurrect accordingly, then put to sleep and announce the next player. If all 3 are alive after this, all 3 die.",,"1,2,3,Bewnans dewisys,Mernans dewisys"
amnesiac,Kovgollor,"You do not know what your ability is. Pub jydh, privately guess what it is: you learn how accurate you are.",Decide the Amnesiac's entire ability. If the Amnesiac's ability causes them to wake tonight: Wake the Amnesiac and run their ability.,If the Amnesiac's ability causes them to wake tonight: Wake the Amnesiac and run their ability.,,?
angel,El,Something bad might happen to whoever is most responsible for the death of a new player.,,,,"Protect,Something Bad"
apprentice,Kynser,"On your 1st night, you gain a Townsfolk ability (if good), or a Minion ability (if evil).","Show the Apprentice the 'You are' card, then a Townsfolk or Minion token. In the Grimoire, replace the Apprentice token with that character token, and put the Apprentice's 'Is the Apprentice' reminder by that character token.",,,An Kynser yw
artist,Artydh,"Unweyth y'n gwari, during the day, privately ask the Storyteller any yes/no question.",,,,Heb gallos
assassin,Ladher,"Unweyth y'n gwari, at night*, choose a player: they die, even if for some reason they could not.",,"If the Assassin has not yet used their ability: The Assassin either shows the 'no' head signal, or points to a player. That player dies.",,"Heb gallos,Marow"
atheist,Didhuwydh,"The Storyteller can break the game rules & if executed, good wins, even if you are dead [No evil characters]",,,,
balloonist,Ayrydh,"Pub nos, you learn 1 player of each character type, until there are no more types to learn. [+1 Outsider]",Choose a character type. Point to a player whose character is of that type. Place the Balloonist's Seen reminder next to that character.,"Choose a character type that does not yet have a Seen reminder next to a character of that type. Point to a player whose character is of that type, if there are any. Place the Balloonist's Seen reminder next to that character.",,"Burjes gwelys,Estren gwelys,Jevan gwelys,Servont gwelys,Viajyer gwelys"
barber,Barver,"If you died today or tonight, the Demon may choose 2 players (not another Demon) to swap characters.",,"If the Barber died today: Wake the Demon. Show the 'This character selected you' card, then Barber token. The Demon either shows a 'no' head signal, or points to 2 players. If they chose players: Swap the character tokens. Wake each player. Show 'You are', then their new character token.",,Treghow gols haneth
barista,Barista,"Pub nos, until dusk, 1) a player becomes sober, healthy and gets true info, or 2) their ability works twice. They learn which.","Choose a player, wake them and tell them which Barista power is affecting them. Treat them accordingly (sober/healthy/true info or activate their ability twice).","Choose a player, wake them and tell them which Barista power is affecting them. Treat them accordingly (sober/healthy/true info or activate their ability twice).",,"Divedhow & Yagh,Gallos diwweyth"
baron,Baron,There are extra Outsiders in play. [+2 Outsiders],,,,
beggar,Beggyer,"You must use a vote token to vote. Dead players may choose to give you theirs. If so, you learn their alignment. You are sober & healthy.",,,,
bishop,Epskop,Only the Storyteller can nominate. At least 1 opposite player must be nominated each day.,,,,"Henwel mas,Henwel tebel"
bonecollector,Kunteller Eskern,"Unweyth y'n gwari, at night, choose a dead player: they regain their ability until dusk.",,"The Bone Collector either shakes their head no or points at any dead player. If they pointed at any dead player, put the Bone Collector's 'Has Ability' reminder by the chosen player's character token. (They may need to be woken tonight to use it.)",,"Gans gallos,Heb gallos"
boomdandy,Tardher,"If you are executed, all but 3 players die. 1 minute later, the player with the most players pointing at them dies.",,,,
bountyhunter,Helghyer,"You start knowing 1 evil player. If the player you know dies, you learn another evil player tonight. [1 Townsfolk is evil]",Point to 1 evil player. Wake the townsfolk who is evil and show them the 'You are' card and the thumbs down evil sign.,"If the known evil player has died, point to another evil player.",,Awonnys
buddhist,Bouddydh,"For the first 2 minutes of each day, veteran players may not talk.",,,,
bureaucrat,Burokrat,"Pub nos, choose a player (not yourself): their vote counts as 3 votes tomorrow.",The Bureaucrat points to a player. Put the Bureaucrat's '3 votes' reminder by the chosen player's character token.,The Bureaucrat points to a player. Put the Bureaucrat's '3 votes' reminder by the chosen player's character token.,,3 raglev
butcher,Kiger,"Pub jydh, after the 1st execution, you may nominate again.",,,,
butler,Botler,"Pub nos, choose a player (not yourself): tomorrow, you may only vote if they are voting too.",The Butler points to a player. Mark that player as 'Master'.,The Butler points to a player. Mark that player as 'Master'.,,Mester
cannibal,Debrer Tus,"You have the ability of the recently killed executee. If they are evil, you are poisoned until a good player dies by execution.",,,,"Marow hedhyw,Posnys"
cerenovus,Serenovus,"Pub nos, choose a player & a good character: they are “mad” they are this character tomorrow, or might be executed.","The Cerenovus points to a player, then to a character on their sheet. Wake that player. Show the 'This character selected you' card, then the Cerenovus token. Show the selected character token. If the player is not mad about being that character tomorrow, they can be executed.","The Cerenovus points to a player, then to a character on their sheet. Wake that player. Show the 'This character selected you' card, then the Cerenovus token. Show the selected character token. If the player is not mad about being that character tomorrow, they can be executed.",,Fol
chambermaid,Chambrer,"Pub nos, choose 2 alive players (not yourself): you learn how many woke tonight due to their ability.","The Chambermaid points to two players. Show the number signal (0, 1, 2, …) for how many of those players wake tonight for their ability.","The Chambermaid points to two players. Show the number signal (0, 1, 2, …) for how many of those players wake tonight for their ability.",,
chef,Kog,You start knowing how many pairs of evil players there are.,"Show the finger signal (0, 1, 2, …) for the number of pairs of neighbouring evil players.",,,
choirboy,Kenyas,"If the Demon kills the King, you learn which player is the Demon. [+ the King]",,"If the King was killed by the Demon, wake the Choirboy and point to the Demon player.",,
clockmaker,Klokkyas,You start knowing how many steps from the Demon to its nearest Minion.,"Show the hand signal for the number (1, 2, 3, etc.) of places from Demon to closest Minion.",,,
courtier,Lysor,"Unweyth y'n gwari, at night, choose a character: they are drunk for 3 nights & 3 days.","The Courtier either shows a 'no' head signal, or points to a character on the sheet. If the Courtier used their ability: If that character is in play, that player is drunk.","Reduce the remaining number of days the marked player is poisoned. If the Courtier has not yet used their ability: The Courtier either shows a 'no' head signal, or points to a character on the sheet. If the Courtier used their ability: If that character is in play, that player is drunk.",,"Heb gallos,Medhow 1,Medhow 2,Medhow 3"
cultleader,Ledyer Kult,"Pub nos, you become the alignment of an alive neighbour. If all good players choose to join your cult, your team wins.","If the cult leader changed alignment, show them the thumbs up good signal of the thumbs down evil signal accordingly.","If the cult leader changed alignment, show them the thumbs up good signal of the thumbs down evil signal accordingly.",,
damsel,Moren,"All Minions know you are in play. If a Minion publicly guesses you (once), your team loses.","Wake all the Minions, show them the 'This character selected you' card and the Damsel token.","If selected by the Huntsman, wake the Damsel, show 'You are' card and a not-in-play Townsfolk token.",,Dismyk usys
deusexfiasco,Deus ex Fiasco,"Once per game, the Storyteller will make a ""mistake"", correct it and publicly admit to it.",,,,Whoops
deviant,Nammek,"If you were funny today, you cannot die by exile.",,,,
devilsadvocate,Pledyer an Jowl,"Pub nos, choose a living player (different to last night): if executed tomorrow, they don't die.",The Devil’s Advocate points to a living player. That player survives execution tomorrow.,"The Devil’s Advocate points to a living player, different from the previous night. That player survives execution tomorrow.",,Treusvewa eksekutyans a wra
djinn,Djinn,Use the Djinn's special rule. All players know what it is.,,,,
doomsayer,Gwethafor,"If 4 or more players live, each living player may publicly choose (Unweyth y'n gwari) that a player of their own alignment dies.",,,,
dreamer,Hunrosyas,"Pub nos, choose a player (not yourself or Travellers): you learn 1 good and 1 evil character, 1 of which is correct.",The Dreamer points to a player. Show 1 good and 1 evil character token; one of these is correct.,The Dreamer points to a player. Show 1 good and 1 evil character token; one of these is correct.,,
drunk,Penn Medhow,"You do not know you are the Drunk. You think you are a Townsfolk character, but you are not.",,,Medhow,
duchess,Duches,"Pub jydh, 3 players may choose to visit you. At night*, each visitor learns how many visitors are evil, but 1 gets false info.",,,,"False Info,Visitor"
empath,Empath,"Pub nos, you learn how many of your 2 alive neighbours are evil.","Show the finger signal (0, 1, 2) for the number of evil alive neighbours of the Empath.","Show the finger signal (0, 1, 2) for the number of evil neighbours.",,
engineer,Jynner,"Unweyth y'n gwari, at night, choose which Minions or which Demon is in play.","The Engineer shows a 'no' head signal, or points to a Demon or points to the relevant number of Minions. If the Engineer chose characters, replace the Demon or Minions with the choices, then wake the relevant players and show them the You are card and the relevant character tokens.","The Engineer shows a 'no' head signal, or points to a Demon or points to the relevant number of Minions. If the Engineer chose characters, replace the Demon or Minions with the choices, then wake the relevant players and show them the 'You are' card and the relevant character tokens.",,Heb gallos
eviltwin,Gevel Drog,"You & an opposing player know each other. If the good player is executed, evil wins. Good can't win if you both live.",Wake the Evil Twin and their twin. Confirm that they have acknowledged each other. Point to the Evil Twin. Show their Evil Twin token to the twin player. Point to the twin. Show their character token to the Evil Twin player.,,,Gevel
exorcist,Dihuder,"Pub nos*, choose a player (different to last night): the Demon, if chosen, learns who you are then doesn't wake tonight.",,"The Exorcist points to a player, different from the previous night. If that player is the Demon: Wake the Demon. Show the Exorcist token. Point to the Exorcist. The Demon does not act tonight.",,Dewisys
fanggu,Fang Gu,"Pub nos*, choose a player: they die. The 1st Outsider this kills becomes an evil Fang Gu & you die instead. [+1 Outsider]",,"The Fang Gu points to a player. That player dies. Or, if that player was an Outsider and there are no other Fang Gu in play: The Fang Gu dies instead of the chosen player. The chosen player is now an evil Fang Gu. Wake the new Fang Gu. Show the 'You are' card, then the Fang Gu token. Show the 'You are' card, then the thumb-down 'evil' hand sign.",,"Kyns,Marow"
farmer,Tiek,"If you die at night, an alive good player becomes a Farmer.",,"If a Farmer died tonight, choose another good player and make them the Farmer. Wake this player, show them the 'You are' card and the Farmer character token.",,
fearmonger,Ownwikor,"Pub nos, choose a player. If you nominate & execute them, their team loses. All players know if you choose a new player.",The Fearmonger points to a player. Place the Fear token next to that player and announce that a new player has been selected with the Fearmonger ability.,"The Fearmonger points to a player. If different from the previous night, place the Fear token next to that player and announce that a new player has been selected with the Fearmonger ability.",,Own
fibbin,Fibbin,"Unweyth y'n gwari, 1 good player might get false information.",,,,Used
fiddler,Krowder,"Unweyth y'n gwari, the Demon secretly chooses an opposing player: all players choose which of these 2 players win.",,,,
fisherman,Pyskador,"Unweyth y'n gwari, during the day, visit the Storyteller for some advice to help you win.",,,,Heb gallos
flowergirl,Bleuennores,"Pub nos*, you learn if a Demon voted today.",,"Nod 'yes' or shake head 'no' for whether the Demon voted today. Place the 'Demon not voted' marker (remove 'Demon voted', if any).",,"Jevan a raglevas,Ny raglevas Jevan"
fool,Bobba,"The first time you die, you don't.",,,,Heb gallos
fortuneteller,Kolyek,"Pub nos, choose 2 players: you learn if either is a Demon. There is a good player that registers as a Demon to you.","The Fortune Teller points to two players. Give the head signal (nod yes, shake no) for whether one of those players is the Demon.","The Fortune Teller points to two players. Show the head signal (nod 'yes', shake 'no') for whether one of those players is the Demon.",,Treustrum
gambler,Happwarier,"Pub nos*, choose a player & guess their character: if you guess wrong, you die.",,"The Gambler points to a player, and a character on their sheet. If incorrect, the Gambler dies.",,Marow
gangster,Gal,"Once per day, you may choose to kill an alive neighbour, if your other alive neighbour agrees.",,,,
general,Pennhembrenkyas,"Pub nos, you learn which alignment the Storyteller believes is winning: good, evil, or neither.","Show the General thumbs up for good winning, thumbs down for evil winning or thumb to the side for neither.","Show the General thumbs up for good winning, thumbs down for evil winning or thumb to the side for neither.",,
goblin,Bocka,"If you publicly claim to be the Goblin when nominated & are executed that day, your team wins.",,,,Lavasosys
godfather,Tasek,"You start knowing which Outsiders are in play. If 1 died today, choose a player tonight: they die. [−1 or +1 Outsider]",Show each of the Outsider tokens in play.,If an Outsider died today: The Godfather points to a player. That player dies.,,"Marow,Marow hedhyw"
golem,Golem,"You may only nominate Unweyth y'n gwari. When you do, if the nominee is not the Demon, they die.",,,,Ny yll henwel
goon,BIlen,"Pub nos, the 1st player to choose you with their ability is drunk until dusk. You become their alignment.",,,,Medhow
gossip,Hwedhler,"Pub jydh, you may make a public statement. Tonight, if it was true, a player dies.",,If the Gossip’s public statement was true: Choose a player not protected from dying tonight. That player dies.,,Marow
grandmother,Mamm Wynn,"You start knowing a good player & their character. If the Demon kills them, you die too.",Show the marked character token. Point to the marked player.,If the Grandmother’s grandchild was killed by the Demon tonight: The Grandmother dies.,,Flogh Gwynn
gunslinger,Gonner,"Pub jydh, after the 1st vote has been tallied, you may choose a player that voted: they die.",,,,
harlot,Hora,"Pub nos*, choose a living player: if they agree, you learn their character, but you both might die.",,"The Harlot points at any player. Then, put the Harlot to sleep. Wake the chosen player, show them the 'This character selected you' token, then the Harlot token. That player either nods their head yes or shakes their head no. If they nodded their head yes, wake the Harlot and show them the chosen player's character token. Then, you may decide that both players die.",,Marow
hellslibrarian,Lyveryas Ufern,Something bad might happen to whoever talks when the Storyteller has asked for silence.,,,,Something Bad
heretic,Kammgryjek,"Whoever wins, loses & whoever loses, wins, even if you are dead.",,,,
huntsman,Treghyas Gwydh,"Unweyth y'n gwari, at night, choose a living player: the Damsel, if chosen, becomes a not-in-play Townsfolk. [+the Damsel]","The Huntsman shakes their head 'no' or points to a player. If they point to the Damsel, wake that player, show the 'You are' card and a not-in-play character token.","The Huntsman shakes their head 'no' or points to a player. If they point to the Damsel, wake that player, show the 'You are' card and a not-in-play character token.",,Heb gallos
imp,Jowlik,"Pub nos*, choose a player: they die. If you kill yourself this way, a Minion becomes the Imp.",,"The Imp points to a player. That player dies. If the Imp chose themselves: Replace the character of 1 alive minion with a spare Imp token. Show the 'You are' card, then the Imp token.",,Marow
innkeeper,Taverner,"Pub nos*, choose 2 players: they can't die tonight, but 1 is drunk until dusk.",,The previously protected and drunk players lose those markers. The Innkeeper points to two players. Those players are protected. One is drunk.,,"Difresys,Medhow"
investigator,Hwithrer,You start knowing that 1 of 2 players is a particular Minion.,"Show the character token of a Minion in play. Point to two players, one of which is that character.",,,"Kamm,Servont"
judge,Breusyas,"Unweyth y'n gwari, if another player nominated, you may choose to force the current execution to pass or fail.",,,,Heb gallos
juggler,Joglour,"On your 1st day, publicly guess up to 5 players' characters. That night, you learn how many you got correct.",,"If today was the Juggler’s first day: Show the hand signal for the number (0, 1, 2, etc.) of 'Correct' markers. Remove markers.",,Ewn
king,Myghtern,"Pub nos, if the dead outnumber the living, you learn 1 alive character. The Demon knows who you are.","Wake the Demon, show them the 'This character selected you' card, show the King token and point to the King player.","If there are more dead than living, show the King a character token of a living player.",,
klutz,Kledhek,"When you learn that you died, publicly choose 1 alive player: if they are evil, your team loses.",,,,
legion,Lyjyon,"Pub nos*, a player might die. Executions fail if only evil voted. You register as a Minion too. [Most players are Legion]",,"Choose a player, that player dies.",,"Marow,Orth eneworrans"
leviathan,Leviathan,"If more than 1 good player is executed, you win. All players know you are in play. After day 5, evil wins.",Place the Leviathan 'Day 1' marker. Announce 'The Leviathan is in play; this is Day 1.',Change the Leviathan Day reminder for the next day.,,"Dydh 1,Dydh 2,Dydh 3,Dydh 4,Dydh 5,Gwarier mas eksekutys"
librarian,Lyveryas,You start knowing that 1 of 2 players is a particular Outsider. (Or that zero are in play.),"Show the character token of an Outsider in play. Point to two players, one of which is that character.",,,"Estren,Kamm"
lilmonsta,Euthvil Bian,"Pub nos, Minions choose who babysits Lil' Monsta's token & ""is the Demon"". A player dies each night*. [+1 Minion]","Wake all Minions together, allow them to vote by pointing at who they want to babysit Lil' Monsta.","Wake all Minions together, allow them to vote by pointing at who they want to babysit Lil' Monsta. Choose a player, that player dies.","An Jevan yw,Marow",
lleech,Gel,"Pub nos*, choose a player: they die. You start by choosing an alive player: they are poisoned - you die if & only if they die.",The Lleech points to a player. Place the Poisoned reminder token.,The Lleech points to a player. That player dies.,,"Marow,Posnys"
lunatic,Muskok,"You think you are a Demon, but you are not. The Demon knows who you are & who you choose at night.","If 7 or more players: Show the Lunatic a number of arbitrary 'Minions', players equal to the number of Minions in play. Show 3 character tokens of arbitrary good characters. If the token received by the Lunatic is a Demon that would wake tonight: Allow the Lunatic to do the Demon actions. Place their 'attack' markers. Wake the Demon. Show the Demon’s real character token. Show them the Lunatic player. If the Lunatic attacked players: Show the real demon each marked player. Remove any Lunatic 'attack' markers.","Allow the Lunatic to do the actions of the Demon. Place their 'attack' markers. If the Lunatic selected players: Wake the Demon. Show the 'attack' marker, then point to each marked player. Remove any Lunatic 'attack' markers.",,"Omsettyans 1,Omsettyans 2,Omsettyans 3"
lycanthrope,Gourvleydh,"Pub nos*, choose a living player: if good, they die, but they are the only player that can die tonight.",,"The Lycanthrope points to a living player: if good, they die and no one else can die tonight.",,Marow
magician,Huder,The Demon thinks you are a Minion. Minions think you are a Demon.,,,,
marionette,Popet,You think you are a good character but you are not. The Demon knows who you are. [You neighbour the Demon],Select one of the good players next to the Demon and place the Is the Marionette reminder token. Wake the Demon and show them the Marionette.,,An Popet yw,
mastermind,Arghkonnyk,"If the Demon dies by execution (ending the game), play for 1 more day. If a player is then executed, their team loses.",,,,
mathematician,Kalkor,"Pub nos, you learn how many players’ abilities worked abnormally (since dawn) due to another character's ability.","Show the hand signal for the number (0, 1, 2, etc.) of players whose ability malfunctioned due to other abilities.","Show the hand signal for the number (0, 1, 2, etc.) of players whose ability malfunctioned due to other abilities.",,Anreyth
matron,Ben'vas,"Pub jydh, you may choose up to 3 sets of 2 players to swap seats. Players may not leave their seats to talk in private.",,,,
mayor,Mer,"If only 3 players live & no execution occurs, your team wins. If you die at night, another player might die instead.",,,,
mezepheles,Mezepheles,You start knowing a secret word. The 1st good player to say this word becomes evil that night.,Show the Mezepheles their secret word.,Wake the 1st good player that said the Mezepheles' secret word and show them the 'You are' card and the thumbs down evil signal.,,"Heb gallos,Treylya tebel"
minstrel,Bardh,"When a Minion dies by execution, all other players (except Travellers) are drunk until dusk tomorrow.",,,,Pubonan medhow
monk,Managh,"Pub nos*, choose a player (not yourself): they are safe from the Demon tonight.",,The previously protected player is no longer protected. The Monk points to a player not themself. Mark that player 'Protected'.,,Difresys
moonchild,Mollether,"When you learn that you died, publicly choose 1 alive player. Tonight, if it was a good player, they die.",,"If the Moonchild used their ability to target a player today: If that player is good, they die.",,Marow
mutant,Stumdreylysek,"If you are “mad” about being an Outsider, you might be executed.",,,,
nightwatchman,Golyador Nos,"Unweyth y'n gwari, at night, choose a player: they learn who you are.","The Nightwatchman may point to a player. Wake that player, show the 'This character selected you' card and the Nightwatchman token, then point to the Nightwatchman player.","The Nightwatchman may point to a player. Wake that player, show the 'This character selected you' card and the Nightwatchman token, then point to the Nightwatchman player.",,Heb gallos
noble,Ughelor,"You start knowing 3 players, 1 and only 1 of which is evil.","Point to 3 players including one evil player, in no particular order.",,,Gwelys
nodashii,No Dashi,"Pub nos*, choose a player: they die. Your 2 Townsfolk neighbours are poisoned.",,The No Dashii points to a player. That player dies.,,"Marow,Posnys"
oracle,Orakyl,"Pub nos*, you learn how many dead players are evil.",,"Show the hand signal for the number (0, 1, 2, etc.) of dead evil players.",,
pacifist,Kresydh,Executed good players might not die.,,,,
philosopher,Filosofer,"Unweyth y'n gwari, at night, choose a good character: gain that ability. If this character is in play, they are drunk.","The Philosopher either shows a 'no' head signal, or points to a good character on their sheet. If they chose a character: Swap the out-of-play character token with the Philosopher token. Or, if the character is in play, place the drunk marker by that player and the Not the Philosopher token by the Philosopher.","If the Philosopher has not used their ability: the Philosopher either shows a 'no' head signal, or points to a good character on their sheet. If they chose a character: Swap the out-of-play character token with the Philosopher token. Or, if the character is in play, place the drunk marker by that player and the Not the Philosopher token by the Philosopher.","An Filosofer yw,Medhow",
